Item_Label,URI,Project,Project_URI,Context,Context_2,Context_3,Context_URI,Latitude,Longitude,Early,Late,Item_Category,icon,Thumbnail,Published_Date,Updated_Date,Creator,Creator_URI,Site_Number,Survey_Date,Survey_Year,Grid_Location_EW,Grid_Location_NS,Height,Subregion,Neolithic,Halaf_Ubaid_Uruk,Chalcolithic,Early_Bronze,Early_Bronze, Middle_Bronze,Middle_Bronze_Late Bronze,Iron_Age,Hellenistic_Roman,Medieval,Name,Description,Site_Name,Collectors_Initials,Map_sheet_no,Local_Landmarks,Setting,Site_Description,Survey_Conditions,Collection_Summary,Collection_Comments,Hellenistic_Late_Roman_note,Medieval_note
KM 48,http://opencontext.org/subjects/1ba904be-e2b7-4573-97a6-e98aa63778cb,Kahramanmaraş Survey,https://opencontext.org/projects/ca4f4719-f2a5-4119-99fa-b04573c8929a,Asia,Turkey,Kahramanmaraş Survey Area,https://opencontext.org/subjects/740f7f3e-8723-4d63-892c-c75d03771d49,37.3551803740865,36.8652696769521,-2200,-333,Site,https://opencontext.org/static/oc/icons-v2/noun-trowel-3586734.svg,https://artiraq.org/static/opencontext/kahramanmaras-survey/thumbs/images-1993/km-41-50/km-48-artifact.jpg,2007-01-01T00:00:00Z,2023-10-07T00:24:06Z,Elizabeth Carter,http://opencontext.org/persons/3208923d-69d0-70e9-9cc1-23ad97770aec,48,1993-06-10T00:00:00Z,1993,109,370,5,Central Valley,false,false,false,false,true,true,true,true,false,false,KM 48,Domuztepe 2,Unnamed Site,All,37SCB,Adana Rd. 1/2 km.  Korocu Höyük visible to NW; field walls,"Corn, cotton, and wheat surround it, near main canal road","Site 1/2 plowed, oval mound heavily disturved by plowing, photos 22 to west, 23, to nw, 24 of Emirler from SE.  Yields many sherds, and once may have been higher","Good, general",Roof Tiles Sherd count Flint count Glass/Faience,"Best 2nd mill site, may go into Iron Age, buff painted wares, red on cream handles, craters, series of everted folded and undercut, band rim jars which are sometimes grooved, red burnished wares, some heavy storage jars one has huge spout with paint--for these periods should be studied in detail.",,
KM 77,http://opencontext.org/subjects/39f38cb0-aa0f-4c7a-a09c-3767aaff59a2,Kahramanmaraş Survey,https://opencontext.org/projects/ca4f4719-f2a5-4119-99fa-b04573c8929a,Asia,Turkey,Kahramanmaraş Survey Area,https://opencontext.org/subjects/740f7f3e-8723-4d63-892c-c75d03771d49,37.3599415651064,37.0776500041651,-3200,1918,Site,https://opencontext.org/static/oc/icons-v2/noun-trowel-3586734.svg,https://artiraq.org/static/opencontext/kahramanmaras-survey/thumbs/images-1993/km-71-80-misc/km-77-school-children.jpg,2007-01-01T00:00:00Z,2023-10-07T00:24:09Z,Elizabeth Carter,http://opencontext.org/persons/3208923d-69d0-70e9-9cc1-23ad97770aec,77,1993-10-15T00:00:00Z,1993,298,368,12,Southeastern Valley,false,false,false,true,false,false,false,false,true,true,KM 77,Aslanbey,Arslanbey,All,37SCB(N38-a4),School and village on top of site,"At edge of hills, overlooking Aksu valley, and ford (?)","Old tell built over by modern village, top flattened by school house, originally main site in this area, but original shape difficult to identify; shown some Byzantine coins.  (From diss appendix - deleted: 77 Arslanbey. Map 37SCB (N38a4). EW 298. NS 368. Diameter 90m. Height 12m. Modern village and school atop mound.  IA. Field notes inconclusive. Check what others have drawn.)","Poor, much garbage, even I won t touch the ayran, many kids, cuts collected separately",Sherd count Flint count Roof Tiles,"EBA comes from cut, but appears to have been a major occupation along with Byz. Islamic and LRoman","Rope impressed, terra sigilata//not see in 2012, primarily Islamic, diagnostics recorded ny Whitcomb","glazed, brown handle with applied decoration"
KM 104,http://opencontext.org/subjects/e33e1bd6-8939-4967-b6fd-e353f748ef6d,Kahramanmaraş Survey,https://opencontext.org/projects/ca4f4719-f2a5-4119-99fa-b04573c8929a,Asia,Turkey,Kahramanmaraş Survey Area,https://opencontext.org/subjects/740f7f3e-8723-4d63-892c-c75d03771d49,37.3385035775153,37.0482436172119,-1200,1918,Site,https://opencontext.org/static/oc/icons-v2/noun-trowel-3586734.svg,https://opencontext.org/static/oc/images/icons/pdf-noun-89522.png,2007-01-01T00:00:00Z,2023-10-07T00:24:12Z,Elizabeth Carter,http://opencontext.org/persons/3208923d-69d0-70e9-9cc1-23ad97770aec,104,1993-10-23T00:00:00Z,1993,272,343,10,Southeastern Valley,false,false,false,false,false,false,false,true,true,true,KM 104,Bertis Beşenli Cif.,"Karabacakhöyğü, Beşebli Çiftlik,","EC,KC,MD",37SCB(N38-a4),Next to big canal by Türkgolu rd. overlooks railroad,Agricultural,"Similar in shape to 103 but much larger upper part forms the ruins of small fort, lower slopes plowed and planted with grapes, small fort now and in past on top, gate on north side (LS- 6/20/97 - poss this refers to large indentation in N side of site now planted under grapes)  6/20/97 site recollected by LS & MK.(see comments under Iron Age below).","Good top +upper 10, lower 10, plowed for grapes, gendarme post on top",Roof Tiles Sherd count,"A number of pie crust rims, applied handles and fine incised pieces, a piece of green and yellow scrafiato. (See LDS comments under IA)",Rope impressed,"glazed blue + scrafiato, pie crust decoration, applied;   Donald Whitcomb confirms Islamic (2001)"
KM 195,http://opencontext.org/subjects/318008c0-b9b9-49a0-88f0-9554ef1df381,Kahramanmaraş Survey,https://opencontext.org/projects/ca4f4719-f2a5-4119-99fa-b04573c8929a,Asia,Turkey,Kahramanmaraş Survey Area,https://opencontext.org/subjects/740f7f3e-8723-4d63-892c-c75d03771d49,37.5927697092569,37.077304758652,,,Site,https://opencontext.org/static/oc/icons-v2/noun-trowel-3586734.svg,https://artiraq.org/static/opencontext/kahramanmaras-survey/thumbs/images-1994/km-190-200/km-195-arch-remains-1.jpg,2007-01-01T00:00:00Z,2023-10-07T00:24:24Z,Elizabeth Carter,http://opencontext.org/persons/3208923d-69d0-70e9-9cc1-23ad97770aec,195,1994-09-09T00:00:00Z,1994,302,628,,Nothern Valley,false,false,false,false,false,false,false,false,false,false,KM 195,Peynirdere,Unnamed Site,"EC,KC,NU,MK,NK",M38-d4,Part of wall located on high natural hill,"Whole area is rocky and covered by scrub, Peynirdere is to se, but location on map difficult because there are no good landmarks--take road from Peynirdere, wind around and then stop after open area, then climb up there is large red  villa to north","Site is on top of hill in mountainous area, single fortified site, a 15m section of wall which may have been vaulted remains about 20m from peak of hill.  Wall is of mid-sized stones with mortar, reputed to have been a crusader castle.",Few sherds collected--slopes are very steep and covered with prickers,Sherd count,,,
KM 182,http://opencontext.org/subjects/6d566685-d1c2-4742-b278-ba1debf86193,Kahramanmaraş Survey,https://opencontext.org/projects/ca4f4719-f2a5-4119-99fa-b04573c8929a,Asia,Turkey,Kahramanmaraş Survey Area,https://opencontext.org/subjects/740f7f3e-8723-4d63-892c-c75d03771d49,37.5761093263751,36.8651002909076,-333,1918,Site,https://opencontext.org/static/oc/icons-v2/noun-trowel-3586734.svg,https://opencontext.org/static/oc/images/icons/pdf-noun-89522.png,2007-01-01T00:00:00Z,2023-10-07T00:24:23Z,Elizabeth Carter,http://opencontext.org/persons/3208923d-69d0-70e9-9cc1-23ad97770aec,182,1994-09-07T00:00:00Z,1994,115,611,,Nothern Valley,false,false,false,false,false,false,false,false,true,true,KM 182,Gelinaslan Tepe,Gelinasılan Tepe,"BB,EC,HT,BB,MK",M37-c4,"Big natural mound near olive groves close to river just west of town, large power line tower marks the sw corner of the site on top, village of Pinarbası down below",Reddish soil with lots of plowed field stones.,"Some exploratory trenches seem to have been dug close to the power pole.  There may have been 2 or three houses up here because of modern roof tile remains.  Extensive rather than deep site for look-out.  One modern excavation showed 1/5 to 2m of deposit--soil above rock, white lens earth below and then white again, collapse above.  Possibly stone foundations with vaulted baked brick superstructures.","Good except for wheat on se flank may obscure site extension, lots of roof tiles, some burnt brick within plaster matrix.",Roof Tiles Sherd count,"Heavy, hard fired grey ware and handles, interesting exterior ledge rim jar sherds one of which has elaborate decoration of finger impressed bands on ledge and a band and groove on rim, also tall necked jar with grooving on neck of interest",KM 182-8 pulled to draw - exact Lidar parallel (see sketch in survey sheets LDS 9-98),"pie crust rim, 9 handles"
KM 122,http://opencontext.org/subjects/a03be213-d14e-463a-8cd9-1f0d73a13a0b,Kahramanmaraş Survey,https://opencontext.org/projects/ca4f4719-f2a5-4119-99fa-b04573c8929a,Asia,Turkey,Kahramanmaraş Survey Area,https://opencontext.org/subjects/740f7f3e-8723-4d63-892c-c75d03771d49,37.5344166689636,36.9132222244455,-3200,-2200,Site,https://opencontext.org/static/oc/icons-v2/noun-trowel-3586734.svg,https://artiraq.org/static/opencontext/kahramanmaras-survey/thumbs/images-1993/km-121-130/km-122-house-1.jpg,2007-01-01T00:00:00Z,2023-10-07T00:24:14Z,Elizabeth Carter,http://opencontext.org/persons/3208923d-69d0-70e9-9cc1-23ad97770aec,122,1993-10-28T00:00:00Z,1993,156,563,5,Nothern Valley,false,false,false,true,false,false,false,false,false,false,KM 122,Hacısarehöyük,Hacisarehöyük,"BP,MD,BG",,Just outside of KM on Türkğoluroad,One  house and one destroyed house on top of mound surrounded by fields.,"Site is heavily disturbed.  Houses, trash, gravel roads and weed make collection almost impossible.  PhotoB12#10,11,12","Survey conditions very bad, survey sample very",,"Very disturbed, one huge orange buff pithos rim could be later",,
KM 191,http://opencontext.org/subjects/116c3fba-8b85-424a-adcd-7085dda82cdd,Kahramanmaraş Survey,https://opencontext.org/projects/ca4f4719-f2a5-4119-99fa-b04573c8929a,Asia,Turkey,Kahramanmaraş Survey Area,https://opencontext.org/subjects/740f7f3e-8723-4d63-892c-c75d03771d49,37.5686111086469,37.0572222215958,640,1918,Site,https://opencontext.org/static/oc/icons-v2/noun-trowel-3586734.svg,https://opencontext.org/static/oc/images/icons/pdf-noun-89522.png,2007-01-01T00:00:00Z,2023-10-07T00:24:24Z,Elizabeth Carter,http://opencontext.org/persons/3208923d-69d0-70e9-9cc1-23ad97770aec,191,1994-09-09T00:00:00Z,1994,286,600,,Nothern Valley,false,false,false,false,false,false,false,false,false,true,KM 191,Kabaktepe,Kabaktepe 2,"EC,NU,KC,NK,MK",M38-d4,"Bordered by small canal to s.e.; located on very slight slope halfway down mountains, rocky scrubby area; village of Yusufhacılı is approximately 1.5 km to the north.",,"Naturally flat area with remains of 1 or 2 houses, Erkenez river bed runs to the south of site; just south of site are wheat fields on lower slopes of mountains; majority of material is roof tiles","Concentrations of roof tiles, pithoi and some smaller sherds; also some flints, visibility is good; surrounding areas checked but nothing to collect",Sherd count Flint count Roof Tiles,"Small collection one interesting rim, large number of flints for late period site",,"exterior thickened grooved and under-cut jar rim may be identifiable, mostly handles, probably Islamic or Medieveal, gritty pithos sherds"
KM 56,http://opencontext.org/subjects/577a0d5d-054f-4877-8234-cd33a7f040b9,Kahramanmaraş Survey,https://opencontext.org/projects/ca4f4719-f2a5-4119-99fa-b04573c8929a,Asia,Turkey,Kahramanmaraş Survey Area,https://opencontext.org/subjects/740f7f3e-8723-4d63-892c-c75d03771d49,37.4078443276962,36.899190098209,-6500,1918,Site,https://opencontext.org/static/oc/icons-v2/noun-trowel-3586734.svg,https://opencontext.org/static/oc/images/icons/pdf-noun-89522.png,2007-01-01T00:00:00Z,2023-10-07T00:24:07Z,Elizabeth Carter,http://opencontext.org/persons/3208923d-69d0-70e9-9cc1-23ad97770aec,56,1993-10-11T00:00:00Z,1993,141,424,4,Central Valley,false,true,true,false,false,false,false,false,false,true,KM 56,Sıçanhöyük,Sıçanhöyük,All,37SCB,"Dry canal and Dani€man T. to west, cement survey point n. end",Mound covered by cotton fields,"To shot 8=to Dani€man T.; 9=Siçan Varto to NE, A€aği Kuyumcular to SE, 10 Siçan, 11= back to Dani€man T., 12=bridge at Dani€man Tepe.  Low oval mound many bones on north slope, recent grave robbing may have churned up an early site.",,Roof Tiles Sherd count Flint count,"Without the one painted and one red-washed sherd,  and obsidian I would think these simple chaff tempered bowls were late and belonged to some special activity.",Rope impressed - Ergun says NO (2001),"late cooking pot handles//yes, late component (SC 9-98)"
KM 175,http://opencontext.org/subjects/621341a8-fe8b-4043-ad46-ed3e9b4c8dd7,Kahramanmaraş Survey,https://opencontext.org/projects/ca4f4719-f2a5-4119-99fa-b04573c8929a,Asia,Turkey,Kahramanmaraş Survey Area,https://opencontext.org/subjects/740f7f3e-8723-4d63-892c-c75d03771d49,37.6372216202892,36.766657419924,-333,300,Site,https://opencontext.org/static/oc/icons-v2/noun-trowel-3586734.svg,https://opencontext.org/static/oc/images/icons/pdf-noun-89522.png,2007-01-01T00:00:00Z,2023-10-07T00:24:22Z,Elizabeth Carter,http://opencontext.org/persons/3208923d-69d0-70e9-9cc1-23ad97770aec,175,1994-05-09T00:00:00Z,1994,34,656,,Nothern Valley,false,false,false,false,false,false,false,false,true,false,KM 175,Göke Mare,Gökçe Mare,"HT,LB,KC,GM,EC",M37-c4,"Off Kyseri Road, electric line disects at Menzelet Baraj, sandstone formation, pine and oak forest above",,Hill side with at least six caves and some scattered occupation on hill side; one cave similar to burial (?) cave recorded at site 93 with  three  beds.,"Good, general",Sherd count,Small collection but appears L. Roman,"Terra sigillata or imitation, 4 sherds real plus one imitation, handle",
KM 18,http://opencontext.org/subjects/9f3fdb2c-fcf7-480b-be7c-64b4c6f412fe,Kahramanmaraş Survey,https://opencontext.org/projects/ca4f4719-f2a5-4119-99fa-b04573c8929a,Asia,Turkey,Kahramanmaraş Survey Area,https://opencontext.org/subjects/740f7f3e-8723-4d63-892c-c75d03771d49,37.275293377736,36.8058630874118,-3200,-2200,Site,https://opencontext.org/static/oc/icons-v2/noun-trowel-3586734.svg,https://artiraq.org/static/opencontext/kahramanmaras-survey/thumbs/images-1993/km-11-20/km-18-from-km-20.jpg,2007-01-01T00:00:00Z,2023-10-07T00:24:03Z,Elizabeth Carter,http://opencontext.org/persons/3208923d-69d0-70e9-9cc1-23ad97770aec,18,1993-09-29T00:00:00Z,1993,55,279,18,Southwestern Valley,false,false,false,true,false,false,false,false,false,false,KM 18,Büyükhöyük,Büyükhöyük,All,37SCB,Circular cement reservoir d=c. 30 m. on top not far from Adana Rd.,"Salad greens to west, wheat cotton and sugar beet","Rock outcrop with small house and reservoir.  Trees growing in furrows and appear to be part of reforestation effort.  Possibly an island in the lake with thin skin of occupation, not much in the way of artificial deposit, but some.","Trees and vegetation cover much of the site, perhaps reservoir also cut some away.  General collection.",Sherd count,"Cooking pot,  thumb impressed tab handle, squared vessel with trapazoidal ledge handles, but inside rounded two egs. one in pink one in red buff wareg\\\T%………………………………………",,
KM 208,http://opencontext.org/subjects/ae5cd335-1cff-40af-9639-ec2f98c9e1a9,Kahramanmaraş Survey,https://opencontext.org/projects/ca4f4719-f2a5-4119-99fa-b04573c8929a,Asia,Turkey,Kahramanmaraş Survey Area,https://opencontext.org/subjects/740f7f3e-8723-4d63-892c-c75d03771d49,37.5215849415374,36.9652740170487,-333,1918,Site,https://opencontext.org/static/oc/icons-v2/noun-trowel-3586734.svg,https://opencontext.org/static/oc/images/icons/pdf-noun-89522.png,2007-01-01T00:00:00Z,2023-10-07T00:24:26Z,Elizabeth Carter,http://opencontext.org/persons/3208923d-69d0-70e9-9cc1-23ad97770aec,208,1994-09-15T00:00:00Z,1994,202,550,0,Nothern Valley,false,false,false,false,false,false,false,false,true,true,KM 208,Unnamed site,Unnamed Site,"LB,EC,GM,NU,HT,MK",M37-c3,"Just N. of KM135, perhaps a gap of 30m between the two. Kahramanmaraş clearly visible to the NE",,"Sherd flint and roof tile scatter in freshly plowed field.  Many roof tiles present, Islamic?  High concentration in small central area ca. 10m in diameter.  Two canals full of water flow through N part of site.  May have been a small farm that was ploughhed over.  Sherds very different from those found at KM 135, modern bracelet","Open field freshly ploughted, no vegetation.  Moderate scatter of sherds etc.  Relatively unrocky soil",Sherd count Flint count Roof Tiles,,Hellenistic Fine ware bowl only one,"glazed dark green inside and out, buff ware bowl with flat exterior overhanging rim with light incision"
KM 192,http://opencontext.org/subjects/164a41ae-ec35-45ec-8392-689953d40140,Kahramanmaraş Survey,https://opencontext.org/projects/ca4f4719-f2a5-4119-99fa-b04573c8929a,Asia,Turkey,Kahramanmaraş Survey Area,https://opencontext.org/subjects/740f7f3e-8723-4d63-892c-c75d03771d49,37.5661821293509,37.0580801059468,640,1918,Site,https://opencontext.org/static/oc/icons-v2/noun-trowel-3586734.svg,https://opencontext.org/static/oc/images/icons/pdf-noun-89522.png,2007-01-01T00:00:00Z,2023-10-07T00:24:24Z,Elizabeth Carter,http://opencontext.org/persons/3208923d-69d0-70e9-9cc1-23ad97770aec,192,1994-09-09T00:00:00Z,1994,292,597,2.5,Nothern Valley,false,false,false,false,false,false,false,false,false,true,KM 192,Turgut Çayırı,Turgut Çayırı,"EC,NU,KC,NK,MK",M38-d4,"Watertank 300m west of site, 3/4 km from the Erkenez;",at edge of flood plain in cotton field,"Low oval mound covered by cotton with wheat fields to the south and east, low stone boundary wall to the south, large stones in center, probably foundation of house","Good, general, lots of roof tiles, some flints",Roof Tiles Sherd count Flint count,"Many light weight pinkish roof tile fragments, otherwise not much probably Islamic",,"fine incised red ware, grooved rim bowl, one rope impressed"
KM 71,http://opencontext.org/subjects/f23b4c0b-24d8-49e1-9c66-3e824f59a3d6,Kahramanmaraş Survey,https://opencontext.org/projects/ca4f4719-f2a5-4119-99fa-b04573c8929a,Asia,Turkey,Kahramanmaraş Survey Area,https://opencontext.org/subjects/740f7f3e-8723-4d63-892c-c75d03771d49,37.4278599585913,37.0017792900144,-6500,300,Site,https://opencontext.org/static/oc/icons-v2/noun-trowel-3586734.svg,https://artiraq.org/static/opencontext/kahramanmaras-survey/thumbs/images-1993/km-71-80/km-71-gen-view.jpg,2007-01-01T00:00:00Z,2023-10-07T00:24:08Z,Elizabeth Carter,http://opencontext.org/persons/3208923d-69d0-70e9-9cc1-23ad97770aec,71,1993-10-14T00:00:00Z,1993,232,444,14,Central Valley,false,true,true,true,false,false,false,false,true,false,KM 71,Sivrecehyk,Sivrecehöyük,All,37SCB,"Near village of same name, canal at foot",In fields,"High, small mound with central hump, possibly a small fort or outpost with some kind of lower town that is now cut into by fields","Heavy vegetation, site, especially lower town cut into by field, little material except from east side cut",Sherd count Flint count,"Only reserved slip I’ve seen looks like the late variety, 1 grey chert sickle blade","Terra sigillata or imitation, rope impressed=pie-crust of Anamorium",
KM 27,http://opencontext.org/subjects/cc445103-8d54-4fb6-a06c-95042bfa57ff,Kahramanmaraş Survey,https://opencontext.org/projects/ca4f4719-f2a5-4119-99fa-b04573c8929a,Asia,Turkey,Kahramanmaraş Survey Area,https://opencontext.org/subjects/740f7f3e-8723-4d63-892c-c75d03771d49,37.3154209089385,36.7755384755124,-333,300,Site,https://opencontext.org/static/oc/icons-v2/noun-trowel-3586734.svg,https://artiraq.org/static/opencontext/kahramanmaras-survey/thumbs/images-1993/km-21-30/km-27-general-view.jpg,2007-01-01T00:00:00Z,2023-10-07T00:24:04Z,Elizabeth Carter,http://opencontext.org/persons/3208923d-69d0-70e9-9cc1-23ad97770aec,27,1993-10-01T00:00:00Z,1993,3,325,4,Southwestern Valley,false,false,false,false,false,false,false,false,true,false,KM 27,Çakmak,Çakmak 1,All,37SCB,Goats and goat pens,Mountain village of 5 or 6 scattered houses,"Pomegranate trees on knoll with low density sherd scatter, no site boundaries visible, probably a similar situation to present day, d=25-30, h=3-4m maybe less",,Sherd count Flint count,,"Terra sigillata or imitation 1 sherd, mostly red body sherds, possibly Byz",
KM 186,http://opencontext.org/subjects/eeb5bf8e-6a94-48e8-aa8a-b39965723ea6,Kahramanmaraş Survey,https://opencontext.org/projects/ca4f4719-f2a5-4119-99fa-b04573c8929a,Asia,Turkey,Kahramanmaraş Survey Area,https://opencontext.org/subjects/740f7f3e-8723-4d63-892c-c75d03771d49,37.5264548647845,37.0640050129628,-333,300,Site,https://opencontext.org/static/oc/icons-v2/noun-trowel-3586734.svg,https://opencontext.org/static/oc/images/icons/pdf-noun-89522.png,2007-01-01T00:00:00Z,2023-10-07T00:24:24Z,Elizabeth Carter,http://opencontext.org/persons/3208923d-69d0-70e9-9cc1-23ad97770aec,186,1994-09-08T00:00:00Z,1994,292,552,22,Nothern Valley,false,false,false,false,false,false,false,false,true,false,KM 186,Hasanin Tarlası,Hasanin Tarlası,"LB,GM,HT,KC,MK",M38-d4,Surrounded by plowed fields to N and W; blends into rolling hills to E and a steep hill to the S.  Power lines cross NW tip of site,,"High oval mound which is very steep on the N slope and is more gradual to the SW and E.  A stream to the s. acts as a boundary line between site and beginning of steep hilly areas, from top of site one gets a good view across the plain to Maraş to the NW, much of the S. slope and top has been plowed.","Visibility is good, greater concentration on top and southern slope; a few sherds from the adjoining hill to the east and field to the north",Sherd count Flint count,"186-1=Pithos rim with gem stamp found on slope, superbly modeled figure with toga, ‘Roman nose, curls, the original gem that made this impression is oval, sort of like a cameo, more rope impressed than almost any other site, jar with impressed circle design and applied, herringbone incised band, cooking pot with rim, rounded shouldered necked jar, possible mortarium, Hellenistic fine ware","Hellenistic Fine ware, rope impressed, red slipped, chocolate chip ware, ungentarium",
KM 205,http://opencontext.org/subjects/ff55ad92-023e-4de3-8212-52d8c5d13134,Kahramanmaraş Survey,https://opencontext.org/projects/ca4f4719-f2a5-4119-99fa-b04573c8929a,Asia,Turkey,Kahramanmaraş Survey Area,https://opencontext.org/subjects/740f7f3e-8723-4d63-892c-c75d03771d49,37.4624716542083,37.0021000762259,-4200,300,Site,https://opencontext.org/static/oc/icons-v2/noun-trowel-3586734.svg,https://opencontext.org/static/oc/images/icons/pdf-noun-89522.png,2007-01-01T00:00:00Z,2023-10-07T00:24:26Z,Elizabeth Carter,http://opencontext.org/persons/3208923d-69d0-70e9-9cc1-23ad97770aec,205,1994-09-14T00:00:00Z,1994,232,482,,Nothern Valley,false,false,true,false,false,false,false,false,true,false,KM 205,Unnamed site,Unnamed Site,"EC,HT,NK,GM,SC,MK",N38-a1,"Cemetery 200m west, 74 to east, Fituşağlı in distnce","Marshy area with drainage canal to east, Pellit H. to N.","Color (grey) differentiated patch, flat site next to burnt wheat field",Good general but few sherds,Roof Tiles,"Small collection, red-black polished ware pipe fragment, not much of a site","Terra sigillata or imitation, rope impressed amphorae handle, white gritty red ware",
KM 5,http://opencontext.org/subjects/cc50e58c-677f-4c6d-b7b8-5907e9d4f023,Kahramanmaraş Survey,https://opencontext.org/projects/ca4f4719-f2a5-4119-99fa-b04573c8929a,Asia,Turkey,Kahramanmaraş Survey Area,https://opencontext.org/subjects/740f7f3e-8723-4d63-892c-c75d03771d49,37.3651654700496,36.9083280271474,-333,1918,Site,https://opencontext.org/static/oc/icons-v2/noun-trowel-3586734.svg,https://artiraq.org/static/opencontext/kahramanmaras-survey/thumbs/images-1993/misc/km-5.jpg,2007-01-01T00:00:00Z,2023-10-07T00:24:01Z,Elizabeth Carter,http://opencontext.org/persons/3208923d-69d0-70e9-9cc1-23ad97770aec,5,1993-09-24T00:00:00Z,1993,14.3,38.9,0,Central Valley,false,false,false,false,false,false,false,false,true,true,KM 5,Altınhöyük,Altın,All,37SCB,"S. of Gölühöyük, Cengis H. to NE 6km east of Adana road",Plowed cotton fields in full bloom.,"Site was found courtesy of owner who leveled at least two small mounds to plant them and collected some finds from a burial.  Original heights are estimated by him at less than 5m, total area 40 donum.  Could have been a small group or groups of farm houses.","We walked the rows turned up by the plow between the cotton plants, and collected the plowed area between two remaining rises separately",,"Fine incised Islamic amphora, slashed green-glazed ware, 1 mold-made piece, one pie-crust rim with incision--these sites may have, numerous amphorae handles.   L. Roman and possibly Hellenistic.","Brittle ware, platter (sharpish angle) (SC 9-98)",Islamic// late and goes way late (LDS 9-98)
