Item_Label,URI,Project,Project_URI,Context,Context_2,Context_3,Context_URI,Latitude,Longitude,Early,Late,Item_Category,icon,Thumbnail,Published_Date,Updated_Date,Creator,Creator_URI,Site_Number,Survey_Date,Survey_Year,Grid_Location_EW,Grid_Location_NS,Height,Subregion,Neolithic,Halaf_Ubaid_Uruk,Chalcolithic,Early_Bronze,Early_Bronze, Middle_Bronze,Middle_Bronze_Late Bronze,Iron_Age,Hellenistic_Roman,Medieval,Name,Description,Site_Name,Collectors_Initials,Map_sheet_no,Local_Landmarks,Setting,Site_Description,Survey_Conditions,Collection_Summary,Collection_Comments,Hellenistic_Late_Roman_note,Medieval_note
KM 220,http://opencontext.org/subjects/f37ee7cc-15df-4fef-af33-aec6b0c26ada,Kahramanmaraş Survey,https://opencontext.org/projects/ca4f4719-f2a5-4119-99fa-b04573c8929a,Asia,Turkey,Kahramanmaraş Survey Area,https://opencontext.org/subjects/740f7f3e-8723-4d63-892c-c75d03771d49,37.3912356522767,36.889155372381,-2200,-1500,Site,https://opencontext.org/static/oc/icons-v2/noun-trowel-3586734.svg,https://artiraq.org/static/opencontext/kahramanmaras-survey/thumbs/images-1994/km-211-220/km-220-gen-view.jpg,2007-01-01T00:00:00Z,2023-10-07T00:24:27Z,Elizabeth Carter,http://opencontext.org/persons/3208923d-69d0-70e9-9cc1-23ad97770aec,220,1994-09-20T00:00:00Z,1994,13.4,40.7,0,Central Valley,false,false,false,false,false,true,false,false,false,false,KM 220,Unnamed site,Unnamed Site,"EC,GM,SC,MK,NK",N37-b2,Railway and Esheikhamza to s. in middle of plowed field,,"Pot drop, several broken vessels and slight soil discoloration with about 50 body sherds and some stones, photo28",Good but heavily plowed,Sherd count,"Probably just a pot drop. but aside from one heavy grit-tempered red ware base looks earlier than Medieval, no diagnostics, no handles, could be spread from EBA site 221 not too far away",,
KM 65,http://opencontext.org/subjects/2cde7561-445a-46ad-adfd-38fe7381df74,Kahramanmaraş Survey,https://opencontext.org/projects/ca4f4719-f2a5-4119-99fa-b04573c8929a,Asia,Turkey,Kahramanmaraş Survey Area,https://opencontext.org/subjects/740f7f3e-8723-4d63-892c-c75d03771d49,37.4466756905057,36.9197777767059,,,Site,https://opencontext.org/static/oc/icons-v2/noun-trowel-3586734.svg,https://artiraq.org/static/opencontext/kahramanmaras-survey/thumbs/images-1993/km-61-70/km-65-tomb-1.jpg,2007-01-01T00:00:00Z,2023-10-07T00:24:08Z,Elizabeth Carter,http://opencontext.org/persons/3208923d-69d0-70e9-9cc1-23ad97770aec,65,1993-10-13T00:00:00Z,1993,158,465,,Central Valley,false,false,false,false,false,false,false,false,false,false,KM 65,Tomb only,Tomb only,"EC,HT,MD",37SCB,In rocks near Narlı Sırtı =mineral spring,rocky hill side,"Single cave-like rock-cut burial, Photos 29-30 of burial ; 31-33 from top back to 64, Orta, Dani€man T.",No sherds found,,,,
KM 118,http://opencontext.org/subjects/633d7081-6695-4591-a725-b299dc9ab882,Kahramanmaraş Survey,https://opencontext.org/projects/ca4f4719-f2a5-4119-99fa-b04573c8929a,Asia,Turkey,Kahramanmaraş Survey Area,https://opencontext.org/subjects/740f7f3e-8723-4d63-892c-c75d03771d49,37.5054366270227,36.932381987488,-4200,1918,Site,https://opencontext.org/static/oc/icons-v2/noun-trowel-3586734.svg,https://opencontext.org/static/oc/images/icons/pdf-noun-89522.png,2007-01-01T00:00:00Z,2023-10-07T00:24:13Z,Elizabeth Carter,http://opencontext.org/persons/3208923d-69d0-70e9-9cc1-23ad97770aec,118,1993-10-27T00:00:00Z,1993,172,53,3.5,Nothern Valley,false,false,true,true,false,false,false,false,false,true,KM 118,Hamamhöyük,Hamamhöyük,"BP,MD,BG",,Railroad tracks near Kiyikci Tepe,Cultivated fields all around.  Höyük planted with wheat burned but not yet plowed this season,"Low mound near railroad.  Recently burned very rich many sherds scattered small stones across site.  Site being regularly cultivated--probably now lower than it originally was.  Photo roll 11, 36.","Very good conditions, sample good",,"There is nothing I can identify with certainty but this could be a second millennium site, carinated bowls some with interior burnish, one brown paint on cream slip, much cooking pot  ware, some late material, weird spouted cooking pot",,pitcher or amphorae
KM 239,http://opencontext.org/subjects/f5585e16-82db-443c-a265-ef098a3b1c31,Kahramanmaraş Survey,https://opencontext.org/projects/ca4f4719-f2a5-4119-99fa-b04573c8929a,Asia,Turkey,Kahramanmaraş Survey Area,https://opencontext.org/subjects/740f7f3e-8723-4d63-892c-c75d03771d49,37.3204882576902,37.0687311766061,-333,1918,Site,https://opencontext.org/static/oc/icons-v2/noun-trowel-3586734.svg,https://opencontext.org/static/oc/images/icons/pdf-noun-89522.png,2007-01-01T00:00:00Z,2023-10-07T00:24:29Z,Elizabeth Carter,http://opencontext.org/persons/3208923d-69d0-70e9-9cc1-23ad97770aec,239,1995-09-12T00:00:00Z,1995,,,4,Southeastern Valley,false,false,false,false,false,false,false,false,true,true,KM 239,Vasıfbey,Vasıfbey,"JS,ÇE,MK",,Setting is a broad flat agricultural terrain s/se of Emiroğlu. Site is between a powerline and road to Vasıfbey.,,"Site is long oval mound, 3-4 m in height.  Area has been freshly plowed and is highly visible, brown soil of the mound contrasts with the light grey soil of surrounding landscape.  No specific surface features visible, and since reconaisance was brief, general outlines of mound have been estimated.  The occupation, however, appears to have been extensive.","Good; site freshly plowed, large quantities of artifacts visible on surface (entirely ceramics no lithics noted)",Sherd count,drain spot,Sherds generally fall into this group--1 piece rouletted ware.,plus clear
KM 112,http://opencontext.org/subjects/f372ea8d-0ea1-4d80-a5e4-59c71b82f36e,Kahramanmaraş Survey,https://opencontext.org/projects/ca4f4719-f2a5-4119-99fa-b04573c8929a,Asia,Turkey,Kahramanmaraş Survey Area,https://opencontext.org/subjects/740f7f3e-8723-4d63-892c-c75d03771d49,37.351027727796,37.1307777698637,-4200,1918,Site,https://opencontext.org/static/oc/icons-v2/noun-trowel-3586734.svg,https://opencontext.org/static/oc/images/icons/pdf-noun-89522.png,2007-01-01T00:00:00Z,2023-10-07T00:24:13Z,Elizabeth Carter,http://opencontext.org/persons/3208923d-69d0-70e9-9cc1-23ad97770aec,112,1993-09-26T00:00:00Z,1993,356,345,5,Southeastern Valley,false,false,true,false,false,false,false,false,false,true,KM 112,Damukhöyük,Damukhöyük,"KC,BP,MK,Meh.",N38-a3,"Near KM 78 on Antep road, pipe line #109, Antep road, mountains directly to east",,"Low mound plowed surrounded by cotton fields the pipeline road runs through, höyük is at pipe post #1019.  Many loose stones scattered around the site cement marker in the center.  Oval shape with low flat area in south",Survey conditions good although H. is plowed making sherding a bit difficult.  Not very many sherds on site.  Sample ok but not great,,,,"glazed brown yellow, fine rope impressed  band on gritty brown ware"
KM 117,http://opencontext.org/subjects/34fd87aa-5767-40c6-b0d9-62300b5cedac,Kahramanmaraş Survey,https://opencontext.org/projects/ca4f4719-f2a5-4119-99fa-b04573c8929a,Asia,Turkey,Kahramanmaraş Survey Area,https://opencontext.org/subjects/740f7f3e-8723-4d63-892c-c75d03771d49,37.5118753667067,36.936236848659,-3200,300,Site,https://opencontext.org/static/oc/icons-v2/noun-trowel-3586734.svg,https://opencontext.org/static/oc/images/icons/pdf-noun-89522.png,2007-01-01T00:00:00Z,2023-10-07T00:24:13Z,Elizabeth Carter,http://opencontext.org/persons/3208923d-69d0-70e9-9cc1-23ad97770aec,117,1993-10-27T00:00:00Z,1993,176,538,6,Nothern Valley,false,false,false,true,false,false,false,false,true,false,KM 117,Çataltepe II,Çataltepe,"BP,BG,MD",,Water tower at Kiyikşi Köy with railroad to west,Park overgrown with weed surrounded by modern 2 story condos.,Medium sized Höyük on natural rise.  Now overgrown with weed difficult to collect sherds.  Trees planted and pipes laid.  Much disturbance to site--fountain in center. Mosque adjacent to site.,"Conditions poor, mound covered with weeds and much disturbance from construction at park",,"Top looked Late Roman, but nothing distinctive; EBA major occupation, but basically very disturbed",Terra sigillata or imitation one sherd,possible Islamic??
KM 126,http://opencontext.org/subjects/a8c96df4-d4f2-4c9f-9c79-e48a01db8bb0,Kahramanmaraş Survey,https://opencontext.org/projects/ca4f4719-f2a5-4119-99fa-b04573c8929a,Asia,Turkey,Kahramanmaraş Survey Area,https://opencontext.org/subjects/740f7f3e-8723-4d63-892c-c75d03771d49,37.5472455482499,36.8893128139053,-4200,-3200,Site,https://opencontext.org/static/oc/icons-v2/noun-trowel-3586734.svg,https://opencontext.org/static/oc/images/icons/pdf-noun-89522.png,2007-01-01T00:00:00Z,2023-10-07T00:24:14Z,Elizabeth Carter,http://opencontext.org/persons/3208923d-69d0-70e9-9cc1-23ad97770aec,126,1993-10-30T00:00:00Z,1993,136,578,,Nothern Valley,false,false,true,false,false,false,false,false,false,false,KM 126,Karnıyarık,Karnıyarık,"BP,MD,BG",M37-c3,KM125,,"Mound is totally ruined by road and canal almost nothing left and much is covered by road gravel stones.  Some sherds in neighboring fields, roof tiles visible on road, impossible to tell size height etc.  Remains cover a small area @ 25 x 25 m but much of mound was probably plowed into fields.","conditions poor, sample poor",Roof Tiles,"I can’t identify the assemblage but the ceramics are low fired chaff tempered ware, occasionally with a red slip, but surfaces are eroded And I’m unwilling to commit to Amuq F.  Some greenish sherds indicate kiln--more obsidian than on any other site, some smoothed grit tempered cooking pot ware. A roof tile and one sherd only trace of late material.  West side of road has so many open bowls that it may  have had some special function.",trace? per EFC comments in sherd descriptions above,
KM 101,http://opencontext.org/subjects/7f8573cc-b893-4aab-a73a-782c00c8a113,Kahramanmaraş Survey,https://opencontext.org/projects/ca4f4719-f2a5-4119-99fa-b04573c8929a,Asia,Turkey,Kahramanmaraş Survey Area,https://opencontext.org/subjects/740f7f3e-8723-4d63-892c-c75d03771d49,37.4748724361281,37.0410972482119,-333,300,Site,https://opencontext.org/static/oc/icons-v2/noun-trowel-3586734.svg,https://opencontext.org/static/oc/images/icons/pdf-noun-89522.png,2007-01-01T00:00:00Z,2023-10-07T00:24:12Z,Elizabeth Carter,http://opencontext.org/persons/3208923d-69d0-70e9-9cc1-23ad97770aec,101,1993-10-22T00:00:00Z,1993,269,498,15,Nothern Valley,false,false,false,false,false,false,false,false,true,false,KM 101,Pelithöyük,Pelithöyük,"EC,KC,MD",37SCB(N38-a4),"Not far from KM-Gaziantep Rd., commanding view of Boz H.",Agricultural,"High large mound, oval shape, probably built on natural rock outcrop, little bits of gravel dot surface, much rope impressed on east face; rectangular structure on top, broader terrace.  Photos=10-4 back to 74, 10-5 back to village, 10-6-7 back to Güzelyurt forest and Antep road","Good, general but covered with sheep shit and recent nomad debris (does this mean there were cuts for their tents? lds)",Sherd count,"This site has more rope impressed, plus rope impressed with fibs than any other site other material indicates Hellenistic, Late Roman  date; one Ottoman pipe fragment; loom weight","Rope impressed, fish plates, black glazed, many handles; chlate chip ware.",
KM 99,http://opencontext.org/subjects/786c6f22-4c0f-4f8b-8207-05b7f5aedd88,Kahramanmaraş Survey,https://opencontext.org/projects/ca4f4719-f2a5-4119-99fa-b04573c8929a,Asia,Turkey,Kahramanmaraş Survey Area,https://opencontext.org/subjects/740f7f3e-8723-4d63-892c-c75d03771d49,37.3332077777985,37.0812198001295,-6500,1918,Site,https://opencontext.org/static/oc/icons-v2/noun-trowel-3586734.svg,https://opencontext.org/static/oc/images/icons/pdf-noun-89522.png,2007-01-01T00:00:00Z,2023-10-07T00:24:11Z,Elizabeth Carter,http://opencontext.org/persons/3208923d-69d0-70e9-9cc1-23ad97770aec,99,1993-10-21T00:00:00Z,1993,299,337,5,Southeastern Valley,false,true,false,false,false,false,false,false,false,true,KM 99,Unnamed mound,Unnamed Site,"EC,MD,KC,BP",37SCB(N38-a4),Gravel road south of main Türkgolu Rd. and canal,"Low rounded mound, no distinctive features","Covered with chaff, general collection, not good",,Sherd count,Few sherds but all but one seem late,,"1 pie crust rim, 1 burnished fish plate"
KM 107,http://opencontext.org/subjects/d0a4f345-53f6-481b-8946-e438fe905af4,Kahramanmaraş Survey,https://opencontext.org/projects/ca4f4719-f2a5-4119-99fa-b04573c8929a,Asia,Turkey,Kahramanmaraş Survey Area,https://opencontext.org/subjects/740f7f3e-8723-4d63-892c-c75d03771d49,37.3203200578811,37.1375326545211,-1200,300,Site,https://opencontext.org/static/oc/icons-v2/noun-trowel-3586734.svg,https://opencontext.org/static/oc/images/icons/pdf-noun-89522.png,2007-01-01T00:00:00Z,2023-10-07T00:24:12Z,Elizabeth Carter,http://opencontext.org/persons/3208923d-69d0-70e9-9cc1-23ad97770aec,107,1993-10-26T00:00:00Z,1993,35,322,2.5,Southeastern Valley,false,false,false,false,false,false,false,true,true,false,KM 107,Çiçek Köy,Çiçek Köy,"BP,MD,KC",,Mountains directly to East on road between Eğlen and Hanobası,Surrounded by wheat fields near mountains separating KM from GAntep valleys with road leading to Antep,Low mound with modern village covering entire site.   Much gravel used to make roads and other debris makes collecting difficult.  Collection area limited to a small portion of the site in a small pepper garden in west section as well as a few trash dumps.  Also difficult to estimate height.  One large worked basalt stone used in field wall garden in north also yielded some sherds,Incomplete sample due to modern village covering site,Roof Tiles,"Little identifiable but modern pot and green glaze ware, roof tiles","Rope impressed, terra sig.","mostly Islamic, brow glaze, dark and lighter green"
KM 30,http://opencontext.org/subjects/9b522a24-919d-4137-8467-168dd85eb8c0,Kahramanmaraş Survey,https://opencontext.org/projects/ca4f4719-f2a5-4119-99fa-b04573c8929a,Asia,Turkey,Kahramanmaraş Survey Area,https://opencontext.org/subjects/740f7f3e-8723-4d63-892c-c75d03771d49,37.2488055540985,36.7879722221745,-3200,1918,Site,https://opencontext.org/static/oc/icons-v2/noun-trowel-3586734.svg,https://artiraq.org/static/opencontext/kahramanmaras-survey/thumbs/images-1993/km-21-30/km-30-general-view-1.jpg,2007-01-01T00:00:00Z,2023-10-07T00:24:04Z,Elizabeth Carter,http://opencontext.org/persons/3208923d-69d0-70e9-9cc1-23ad97770aec,30,1993-10-02T00:00:00Z,1993,37,252,6,Southwestern Valley,false,false,false,true,false,false,false,false,false,true,KM 30,,Unnamed Site,All,37SCB,"Field wall dissects site in featureless area of former lake bed,  Adana Road to west, clay pits 7-8 meters deep to S.",Edge of former lake bed or island,"Small low mound, a no. of heavy sherds some with incisions.  Roll 4-36 to east","Good, plowed but with chaff cover",Sherd count,"Probably same period as tombs, a number of heavy pieces relative few sherds",,Rope impressed
KM 79,http://opencontext.org/subjects/a9448efc-12a2-4a3d-89fc-7bca87ef6060,Kahramanmaraş Survey,https://opencontext.org/projects/ca4f4719-f2a5-4119-99fa-b04573c8929a,Asia,Turkey,Kahramanmaraş Survey Area,https://opencontext.org/subjects/740f7f3e-8723-4d63-892c-c75d03771d49,37.3324444414613,37.1061944439107,-333,300,Site,https://opencontext.org/static/oc/icons-v2/noun-trowel-3586734.svg,https://artiraq.org/static/opencontext/kahramanmaras-survey/thumbs/images-1993/km-71-80/km-79-from-sw.jpg,2007-01-01T00:00:00Z,2023-10-07T00:24:09Z,Elizabeth Carter,http://opencontext.org/persons/3208923d-69d0-70e9-9cc1-23ad97770aec,79,1993-10-16T00:00:00Z,1993,319,331,3,Southeastern Valley,false,false,false,false,false,false,false,false,true,false,KM 79,On Osmanded road,Unnamed Site,All,37SCB(N38-a4),"Osmandede Road to E., Türkgolu Rd. W. 300 m.",In middle of sugar beet fields,"Site plowed and in middle of harvested plowed fields, late farm? house.",Good,Roof Tiles,"This is the finest pottery I have seen; green buff, very compact, thin beautifully made difficult to distinguish from EBA","Hellenistic Fine ware, grooved rims, terra sigilata, red burnished, burnished coarse ware",
KM 130,http://opencontext.org/subjects/e0d59022-f591-4059-8676-fd07d3b47738,Kahramanmaraş Survey,https://opencontext.org/projects/ca4f4719-f2a5-4119-99fa-b04573c8929a,Asia,Turkey,Kahramanmaraş Survey Area,https://opencontext.org/subjects/740f7f3e-8723-4d63-892c-c75d03771d49,37.5231081175699,36.8772837038801,-4200,1918,Site,https://opencontext.org/static/oc/icons-v2/noun-trowel-3586734.svg,https://artiraq.org/static/opencontext/kahramanmaras-survey/thumbs/images-1994/km-121-130/km-130-gen-view.jpg,2007-01-01T00:00:00Z,2023-10-07T00:24:15Z,Elizabeth Carter,http://opencontext.org/persons/3208923d-69d0-70e9-9cc1-23ad97770aec,130,1994-08-23T00:00:00Z,1994,118,549,6,Nothern Valley,false,false,true,false,false,false,false,false,false,true,,,Yılanlı,All,M37-c4,"In fields next to asphalt dam road, heavily cut so that original shape and size are difficult to determine","Eggplant, rice, cucumber, corn, bieber, tomatoes, rice irrigated from dam?","Oval mound planted over, Ösen to w., Maraş, w. suburbs to north and Cinli H. visible to N., 305 degrees from Kadıoğlu Çift.  190 degrees from Cinli H., 20 stone basalt mortar; 21 site from ne","General, site very disturbed by agricultural work, probably more than we got",Roof Tiles,"Roof tile, one sherd looks EBA, rest late udetermined.",nothing distinctive,"fine incised, red with white grits plaster slip"
KM 106,http://opencontext.org/subjects/454fca3b-03bd-4c18-8e78-8951101efe35,Kahramanmaraş Survey,https://opencontext.org/projects/ca4f4719-f2a5-4119-99fa-b04573c8929a,Asia,Turkey,Kahramanmaraş Survey Area,https://opencontext.org/subjects/740f7f3e-8723-4d63-892c-c75d03771d49,37.276556935438,37.0312664310317,640,1918,Site,https://opencontext.org/static/oc/icons-v2/noun-trowel-3586734.svg,https://opencontext.org/static/oc/images/icons/pdf-noun-89522.png,2007-01-01T00:00:00Z,2023-10-07T00:24:12Z,Elizabeth Carter,http://opencontext.org/persons/3208923d-69d0-70e9-9cc1-23ad97770aec,106,1993-10-23T00:00:00Z,1993,255,275,5,Southeastern Valley,false,false,false,false,false,false,false,false,false,true,KM 106,Unnamed,Unnamed Site,"EC,KC,MD",37SCB(N38-a4),"Karahöyük school to south, large canal",Agricultural surrounded by fields,"Round mound with field wall in center, map give d=100, I guess 75; while looking for site somewhat to the west a flint scatter with natural and a few possible tools identified.","General, completely plowed, very difficult",Roof Tiles Flint count Sherd count,Little identifiable but probably Islamic,Sc noted 1st mill BC material (9-98); don t see any,"handle types look Islamic; glzed, fine incised, pix sent to Asa for id"
KM 218,http://opencontext.org/subjects/b8738513-ee50-46eb-affa-36cfaee6415e,Kahramanmaraş Survey,https://opencontext.org/projects/ca4f4719-f2a5-4119-99fa-b04573c8929a,Asia,Turkey,Kahramanmaraş Survey Area,https://opencontext.org/subjects/740f7f3e-8723-4d63-892c-c75d03771d49,37.3927844402744,36.9430546526051,640,1918,Site,https://opencontext.org/static/oc/icons-v2/noun-trowel-3586734.svg,https://opencontext.org/static/oc/images/icons/pdf-noun-89522.png,2007-01-01T00:00:00Z,2023-10-07T00:24:27Z,Elizabeth Carter,http://opencontext.org/persons/3208923d-69d0-70e9-9cc1-23ad97770aec,218,1994-09-20T00:00:00Z,1994,180,406,,Central Valley,false,false,false,false,false,false,false,false,false,true,KM 218,Near Tatlıdedeler,Tarla Höyük,"EC,GM,SC,MK",N37-b2,Post no. 2 on railway next to village of Tahtalıdedeler,,Flattened site of little distinction in middle of recently plowed fields.,Poor,Roof Tiles,"Very few sherds, but handles suggest Medieval, 1 yellow glaze interior , but we did not go inside very far, could this be a church???",,glazed
KM 90,http://opencontext.org/subjects/c21412c1-2621-4ed1-8110-ca362c2d0fd1,Kahramanmaraş Survey,https://opencontext.org/projects/ca4f4719-f2a5-4119-99fa-b04573c8929a,Asia,Turkey,Kahramanmaraş Survey Area,https://opencontext.org/subjects/740f7f3e-8723-4d63-892c-c75d03771d49,37.3143614980909,37.0355043403267,640,1918,Site,https://opencontext.org/static/oc/icons-v2/noun-trowel-3586734.svg,https://artiraq.org/static/opencontext/kahramanmaras-survey/thumbs/images-1993/km-81-90/km-90-gen-view.jpg,2007-01-01T00:00:00Z,2023-10-07T00:24:10Z,Elizabeth Carter,http://opencontext.org/persons/3208923d-69d0-70e9-9cc1-23ad97770aec,90,1993-10-18T00:00:00Z,1993,258,321,6,Southeastern Valley,false,false,false,false,false,false,false,false,false,true,KM 90,Kuçuk Höyük,Küçükhoyuk,All,37SCB(N38-a4),Huge canal to NE,Agricultural,"Round mound in middle of plain but surrounded by hills, roof tiles at foot.  Location should be checked in 94.  Revisited by J. Snead 12 Sept 95.  Conditions similar to that of orig. visit.  Small collection made.  Note that the name Küçükhoyuk  was formerly attributed to site 89 which was incorrect. Revisited by Liz and Angela for GPS in 2000.","Good, general, light fading",Roof Tiles,Seems primarily late although two flints and some painted handles could be earlier,,"glazed, fine incised"
KM 146,http://opencontext.org/subjects/d621c11c-c24e-459e-8964-224d469dc0e7,Kahramanmaraş Survey,https://opencontext.org/projects/ca4f4719-f2a5-4119-99fa-b04573c8929a,Asia,Turkey,Kahramanmaraş Survey Area,https://opencontext.org/subjects/740f7f3e-8723-4d63-892c-c75d03771d49,37.5236527625521,36.8309541344329,640,1918,Site,https://opencontext.org/static/oc/icons-v2/noun-trowel-3586734.svg,https://artiraq.org/static/opencontext/kahramanmaras-survey/thumbs/images-1994/km-141-150/km-146-near-form.jpg,2007-01-01T00:00:00Z,2023-10-07T00:24:17Z,Elizabeth Carter,http://opencontext.org/persons/3208923d-69d0-70e9-9cc1-23ad97770aec,146,1994-08-27T00:00:00Z,1994,82,551,3,Nothern Valley,false,false,false,false,false,false,false,false,false,true,KM 146,Merdan gps taken at foot of mound access difficult,Merdan,,M37-c4,"Round mound w. of Ösen, broken forest to w., irrigation canal at foot","wheat fields, cotton to south, rolling hills with broken forest to w.","Rocky surface round mound slightly higher on west, photo 4-3 to N., 0-2 Kabak tepe and houses; many architectural elements roof tiles, drain spouts; flints may indicate an earlier occupation. diss appendix entry deleted: POSS REMOVE  146	Merdan. Map M37c4. EW 82. NS 551. Diameter 120m. Height 3m.. Round rocky mound west of Ösen.  IA. 3b?; 7d?; 5t?. Field notes inconclusive. Check what others have drawn.",,Sherd count Roof Tiles,"Predominant ware is heavy white grit tempered red ware, huge pithos rims and sherds, many handle, some rope impressed, but  not much in the way of Hellenistic, Late Roman appears to be  Medieval",,"byz- Islamicine incised, black glazed, handles, lots of white tempered red ware"
KM 134,http://opencontext.org/subjects/412047f4-f4e9-4ca5-a807-f99c10f4649d,Kahramanmaraş Survey,https://opencontext.org/projects/ca4f4719-f2a5-4119-99fa-b04573c8929a,Asia,Turkey,Kahramanmaraş Survey Area,https://opencontext.org/subjects/740f7f3e-8723-4d63-892c-c75d03771d49,37.5532636026512,37.0813716118244,-10000,-6500,Site,https://opencontext.org/static/oc/icons-v2/noun-trowel-3586734.svg,https://opencontext.org/static/oc/images/icons/pdf-noun-89522.png,2007-01-01T00:00:00Z,2023-10-07T00:24:15Z,Elizabeth Carter,http://opencontext.org/persons/3208923d-69d0-70e9-9cc1-23ad97770aec,134,1994-08-25T00:00:00Z,1994,370,582,131.5,Nothern Valley,true,false,false,false,false,false,false,false,false,false,,,Alıçlıtarla,"HT,GM,KC",M38-d4,"Surrounded by cotton fields to WE and S.; 100m s of Erkenez river bed; several farm houses, .5 km to SE (Erkeşlar Obası); power lines run to N. of site",,"Northeastern half of mound is higher mound which overlooks the river bed, while southwestern side blends gradually into cotton fields.  Half of site planted with cotton other half is burnt field, site appears to be on a plateau that is cut by the river","Visibility is good especially in burnt field, tons of flint everywhere; more sherds in cotton half of sites, several bags of flint collected",Sherd count Flint count,"Flint production site with tons of flint, no obsidian and few Neolithic sherds, flint colors= light red, white, grey and honey brown but few tools, mostly ad hoc scrapers?? Site needs redstudy especially flint collections.  Many pieces with cortex, only a few cores and some very large flakes that may be from core reduction?",,
KM 47,http://opencontext.org/subjects/722845d1-a0de-4541-acc7-da2b10cf8666,Kahramanmaraş Survey,https://opencontext.org/projects/ca4f4719-f2a5-4119-99fa-b04573c8929a,Asia,Turkey,Kahramanmaraş Survey Area,https://opencontext.org/subjects/740f7f3e-8723-4d63-892c-c75d03771d49,37.3134375669751,36.9656765392623,-333,300,Site,https://opencontext.org/static/oc/icons-v2/noun-trowel-3586734.svg,https://artiraq.org/static/opencontext/kahramanmaras-survey/thumbs/images-1993/km-41-50/km-47-gen-view.jpg,2007-01-01T00:00:00Z,2023-10-07T00:24:06Z,Elizabeth Carter,http://opencontext.org/persons/3208923d-69d0-70e9-9cc1-23ad97770aec,47,1993-05-10T00:00:00Z,1993,198,318,2,Central Valley,false,false,false,false,false,false,false,false,true,false,KM 47,flat site near Çakmak village,Unnamed Site,All,37SCB,"Field wall, Çamak village 1 km to n.e., 500m ne to spring",Edge of stony hills in wadi,Site has been spread over field,General,Roof Tiles Sherd count Flint count,"Very coarse rims with much mineral temper, one fine incised, mostly a good L. Roman collection; drain spout and roof tiles","Terra sigillata or imitation, ridged cooking pot terra sigilata, Late Roman cut handle, rope impressed","handels, incised Islamic green-buff warew"
